{
  "schema_version": "2.0.0",
  "session_id": "018f1e2d-3c4b-7a02-8c9d-001122334456",
  "tenant_id": "018f1e2d-3c4b-7a01-8c9d-001122334455",
  "funnel_stage": "qualification",
  "methodology": "consultative",
  "qualification": [
    {
      "dimension": "need",
      "status": "confirmed",
      "value_summary": "Responder leads mais rápido.",
      "evidence_refs": [
        "018f1e2d-3c4b-7a05-8c9d-001122334459"
      ]
    }
  ],
  "objections": [],
  "proposal_status": "not_started",
  "conversion_probability": 0.45,
  "next_step": "Confirmar autoridade e prazo.",
  "updated_at": "2026-07-14T20:05:00Z"
}
